Content,Type
smitten kitchen appl cheddar salad would humbl argu excel one best ’ ever made recip also excus share best trick keep sleev alway want cook said thing like might actual find lost piec popcorn make kind complex salad never resist cafe menu home simpli possibl deserv fanci cool crunchi dynam gorgeou salad home even live life allow us afford fanci salad made other regular basi first element follow basic salad math equat crispi chees fresh chees grate chees melt oven flake golden laci chees crisp easier make better crouton mile said said second element stem belief salad without pickl element sad one soak minc shallot onion vinegar portion dress lightli pickl make rest salad low-effort way make happen final thing absolut love busi salad kind candi spici salti nut find almost everi recip much work sticki want one could make whole pan doubl whole pan store extra room temperatur stay crisp merg one mega-clust use need — tomorrow ’ salad morn bowl yogurt snack mani snack found coolest trick buri restaur recip famou kale salad rins ye rins nut toss littl bit powder sugar salt spice ’ like ’ use cayenn bake crisp cluster last year ’ use innumer time almost everi kind nut seed ’ turn,Food
smitten kitchen septemb favorit food weather outlook number day 90 degre final peter live cardigan weather love goe beach weekend goe cinnamon stick warm cider market still teem peach plum zucchini eggplant also go appl pick find fanci new squash cook cook alway feel like ’ one team anoth — ’ either make capres ’ bake ziti littl in-between day intersect summer winter squash ’ peach grape pie let ’ fix read someth call magic peach cobbler make less entir pan bake oven say 15 minut later made stronger stuff come way grandmoth ian knauer go way back site ’ find ’ also person behind exquisit brown butter brown sugar shorti day gourmet day ’ got place call farm cook school stockton new jersey spoke recent grandmoth seven kid time fuss anyth straightforward recip like scour hundr recip conclud nobodi agre cobbler asid cousin grunt pandowdi slump dough-boy never get tire referenc bake good funni name recip agre ’ fruit bottom top either cake batter dollop biscuit dumpl dough sure enough exampl archiv one cornmeal drop biscuit anoth crispi cake lid renegad grandmoth — sound like good life goal tbh — ’ even follow rule ’ butter eggless pancake-lik batter fruit goe top oven get envelop like buckle–styl cake creat deep pocket collaps fruit crisp edg scoop still warm dish vanilla ice cream top quickli succumb unless finish first believ one year ago zucchini rice chees gratin two year ago cauliflow slaw three year ago fudgi chocol sheet cake four year ago roast appl spice sheet cake five year ago roast tomato soup broil cheddar six year ago skirt steak salad arugula blue chees seven year ago snickerdoodl eight year ago spinach quich nine year ago chocol babka red velvet cake,Food
smitten kitchen five minut — rememb infant 6 year-old two full-tim job big apart intern busi trip month sadli mine doubt actual made whatev requir pull — thought might friendsgiv dinner parti year love thanksgiv want life ditto friend also dinner parti everyth go awesom ’ plan menu perfect thanksgiv dinner wrote head probabl five year ago hear alton brown ’ turkey recip one ’ ever need dri brine mayb lacquer thing mayb mash-up mayb import smoke one texa chill host histori thanksgiv ever amiright right well everyth els plan fun began decid new tradit requir new special cocktail would forev tie time place gener ’ classicist sangria like us ’ endur sort disturb ingredi masquerad sangria — sprite frozen lemonad coconut rum basil ton sugar whhhi ingredi ’ pull first googl result sangria — tri mess ’ alway work turn ’ upend tradit obnoxi make appl cider sangria dream red wine use dri white brandi use appl brandi calvado instead splash juic use appl cider ’ reduc would concentr flavor kept less tradit tripl sec place like hint orang skip less sangria blasphemist fruit use mix appl like everyon els overdid appl farm octob result even better ’ hope apple-i adult way subtl terribl sweet kid ran hallway sugar-demon haze trick-or-tr friend ’ build last weekend grownup got sip glass uh grown-up candi save actual candy-thiev fall asleep parent privileg cours,Food
smitten kitchen recip cook list ’ plot year take forev jump place ’ rough idea think someth might tast good ’ make happen item list name dish ’ tri yet want learn recip make kick everi time see made good hearti tortilla soup yet russian napoleon ’ promis none exactli one month ago someon email hi angela ask ever made german sunken appl cake sound even cooler nativ languag versunken apfelkuchen bare finish read email new tab open immedi know ador serious ’ relentlessli cute small appl peel halv core score arrang rump-up butteri cake base oven cake begin creep around appl fan like accordion whole thing golden dimpl love abandon hope plan anyth els could make happen perhap predict still took three week realiz peopl “ relentlessli cute ” i.e cake version viral video kitten scare skitter ball yarn primari thing ’ look cake mean ’ friend anyon cold-heart realiz thing like crumb/texture/flavor also import talk cake fear cake drove ’ actual terribl differ last year ’ purpl plum tort extra egg leaven lift say ’ awesom especi day two beyond promis site would remain pumpkin-spic free zone first day fall know tomorrow mean cake neither cinnamon nutmeg ginger allspic clove ’ pumpkin diction poor mine appar disappoint dozen peopl tell cake make hear instead “ pumpkin appl cake ” howev ’ resist give honey tilt replac half sugar honey brush cool cake salt honey glaze ’ tradit imagin cake way thank everyon came word street toronto yesterday fun event never bad time around friendli warm peopl,Food
smitten kitchen sever stuffing-rel confess unload today first stuf love found friend ’ hous mother serv us appl stuf pepperidg farm mix longer made presum ’ 1989 god nag mother ’ terribl keen packag food meani make sometim ’ cave though never often enough ’ stop grow think dreamiest stuf includ tart appl celeri lightli caramel onion herb dream repeatedli deni child ye ’ request tini violin think ’ limit stuf consumpt singl day novemb miss snip stuf free holiday-specif tether ’ take long realiz welcom could spear onto fork 364 day year categori share latk awesom cocktail parti weekend breakfast top lacy-edg fri egg especi fit year yule log thanksgiv mega-yodel fairi light even pretend ’ awesom strung across yard juli even outlin shutter fire escap decemb would eat stuf everi week year everyon would stop look strang insist stuf tast amaz breakfast meal loos cook egg top lunch asid salad instead roll dinner day thanksgiv lieu grain potato went extens length develop recip call breakfast stuf realli stuf meal smitten kitchen cookbook someth herb savori realli eggi breakfast strata stud favorit stuf flavor test test test enjoy enjoy enjoy nobodi els could get head around everi person mention said “ yeah breakfast stuf huh ” oh-that-scribble-was-a-dinosaur voic know oh-that-scribble-was-a-dinosaur voic pull live comput sinc hope one day find home ’ four year mayb ’ time,Food
smitten kitchen one favorit octob tradit pick mani appl weekend ago mayb perhap 25 pound need ’ hard gaug realiz ’ never appl orchard octob ’ escap citi find quiet grove leav start turn sky unimagin blue ’ wear first thick sweater season ’ hard imagin one accident pick 25 pound mani appl bet ’ felt fun pluck crisp unblemish unwax appl tree let branch snap back leav flutter droplet last night ’ rain face ’ probabl gotten carri away think pick mani appl octob import tradit burn food backyard grill juli 4th weekend go whole jar cinnamon everi fall ’ go happen either way ’ best embrac got back distinctli not-grove-s apart ’ anywher put start applesauc eight pound move onto oatmeal cookie-ish crumbl would like recip chip away pound apiec son ’ preschool make someth appl “ let donat pleas ” whole wheat appl muffin enlist 2 appl pancak anoth 2 made applesauc 4 pound sudden 6 appl left devast ’ forgotten make pie forget make pie nobodi friend especi come pie realiz slab pie someth new discuss realm sour cherri season long averag blink slab pie deserv time sever good thing know higher proport crust-to-fil standard 9-inch round double-crust pie ’ flaki butteri crust hello welcom home speak flaki butteri ’ found crust slab pie unweight thick fruit fill tend puff gorgeou flake far readili standard pie crust ’ thing like slab pie slice portabl like thick thick pop tart hand pie kind requir peski roll cut seal repeat ’ longer certain even realli like pie friend enough worth slab pie would never,Food
smitten kitchen husband like joke everi comment site month octob “ help went appl pick brought home 20 pound appl ’ know use ” ’ true cours ’ everi five six comment mostli giggl ’ know one could go appl grove realiz 20 pound appl imposs amount munch way matter enthusiast apple-eat might furthermor see quit often one appl type ripe time ’ like even bring mix home might sustain interest appl appl ad inifinitum know go guy went appl pick last weekend brought home almost 15 pound appl kid mostli idea first 6 pound went largest batch applesauc ever half freezer resid applesauc junki next pound munch happili pound tabl bowl though think ramona quimbi must snuck keep notic singl tini bite taken first bite tastiest next well happen happen think ’ go glad bunch pound appl left kind stuff call repeat perform take submiss new favorit dead simpl fall dessert understand competit arena pretti fierc ’ alreadi share pumpkin cinnamon roll month ’ expect throw quickli win octob belli mind race help releg breakfast categori cours still leav simplest appl tart everi five year well think new simpl appl tart town think one,Food
smitten kitchen smitten kitchen cookbook first cookbook turn 10 year old week insid call one best summer dessert ’ ever made peach dumpl bourbon hard sauc whim occur one morn dawn then-babi 11 day ago bar mitzvah woke earli lack interest go back sleep mind drift thing ’ like cook peach dumpl model old-fashion appl dumpl ’ sure took long revers process fall ’ want bake anyth els ’ absolut obsess perfect packet appl pie everyth love peach dumpl true crust unhind heavi fill expand flake like puff pastri cut trickl butteri brown sugar caramel flood plate best part actual mess — chunk spice bake fruit butteri layer dough mingl puddl juic like splash whiskey appl dessert go swoon sauc melt side pleas make soon ’ glad ‘ mean disappear newslett might guess thrown cours aforement bar mitzvah “ ’ bar mitzvah “ 13th birthday — seem imposs born right — excit thing smitten kitchen keeper third cookbook 48 day week earlier origin plan work put final detail togeth fall 2022 book tour — ’ everyth next thursday 10/6 might even anoth new recip sinc behind post cook hooray cover everyth probabl forgot someth away comment,Food
smitten kitchen ’ hardli biggest surpris parent ’ yet get head around idea ’ taken part creat morn person son alway woken earli ’ 5/5:30am ’ sofa read thick book wonder care watch sunris year ’ tri everyth chang wire — lectur star chart briberi beg ask pediatrician talk sens although “ wake earli read chapter book ” ’ quit doom-and-gloom impact ’ thought would prayer — eventu might infer refer wire gave wake crack dawn also requir breakfast earlier hour normal peopl like parent love sleep ’ uh confus “ breakfast food ” ’ taken pack breakfast leav fridg hard-boil egg fruit chees sort muffin work way muffin archiv realiz miss one hippie/morn glory-ish muffin love load carrot appl dri fruit sometim coconut spice ’ made version last month go anoth round new tomororw wonder cookbook arriv doorstep yossi arefi ’ snack cake probabl ’ need tell idea snack cake firmli within sk wheelhous — think cake everyday just-because-it ’ s-monday thing lucki us arefi went right morn glori cake wonder ’ fuss muffin liner tri achiev perfect dome pour pan much easier ’ tweak arefi ’ recip make even breakfast-i — lower sugar oil bit swap whole wheat flour raw sugar white ad dri fruit well coconut nod origin ginger like use toast salt pepita top cake remain plush perfect whatev hour call breakfast know morn glori muffin offici recip pam mckinstri creat 1978 restaur nantucket recip first publish gourmet 1981 wildli popular decad,Food
smitten kitchen boulder dramat intersect two favorit thing cinnamon bake appl thick crumb cake ’ know make crumb cake new york grew new jersey crumb cake ’ genteel cinnamon-ribbon fine streusel- coffe cake hefti squar ’ 50 crumb top 50 golden sour cream-enrich cake ’ want way thank brown sugar cinnamon crumb top alway dark stripe snow-cap powder sugar ’ option fruit good fresh appl skip loud attention-demand cake ’ still talk cake think delic slice dice appl use full pound thick wedg snug tightli bare fit confin all-too-accur new york real estat stori squeez crumb small hand break appl creat boulder-lik piec bake cake almost hour slightli lower temperatur give appl enough time get tender juic bubbl kitchen smell minimum like bliss epiphani appl brown sugar cinnamon peak melodrama absolut best decis ’ made yet octob ’ back ’ miss never intend take long break pull vacat short manuscript deadlin next book quick two-week photoshoot 100 recip 10 day oh btw ’ photograph emerg like sparkli new thing ’ want share recip alreadi readi new one piqu interest buri one thing ’ differ sk sometim better occasion wors ’ editori recip develop staff one life get busi central dedic space — turn 15 fall — remain unchang good luck ever get rid good,Food
smitten kitchen intend go appl pie make bender mere alway octob go appl pick balk price bag insist upon fill way past brim econom ate appl way home home bag still overflow made appl pie 4.25 pound appl bag look exactli full orchard might still grow ’ explan new watch make youtub start appl pie recip ’ site 12 year year ’ tweak littl home small way differ spice level brown sugar work thinner slice time help geniu bravetart book tweak lot best appl pie ’ ever made ration thing brought slice pie-brag everyon saw coupl day ran pie made anoth one use tweak best appl pie ’ ever made ration thing made third one think ’ time us talk think made much better loyalti old pie recip want talk new post know peopl make yearli ’ want chang way ’ written pie 12 year old — pie recip would middl school right — ’ okay ’ person toddler year ’ project ’ project pie okay waaah ’ littl differ day skip right recip ’ insid basebal,Food
smitten kitchen welcom second episod sous-chef seri sporad featur sk invit cook admir small kitchen teach — thu us — make one specialti spoiler ’ sou previous make potato vareniki kachka ’ bonni frumpkin almost without fail bafflingli short ingredi list stunningli delici outcom like rivet ’ need recip 5- 10- fewer ingredi — fare poorli arbitrarili restrict confin — ’ blow mind make appl tart tatin appl sugar butter lemon juic sheet defrost puf pastri abl made well upside-down appl tart look like snug copper cobbleston top rippl puff flaki pastri ’ lucki appl tast like drank cup caramel nap ’ finish love enough ’ written twice eleven year effort were… mediocr best mean look — thin spars pale appl either under- overcook way mani appl dissolv long cook time despit “ good bake appl ” ’ begrudgingli resign life tatin mediocr spot one stun one ’ seen date magazin stand feel knew cooked/styl — across-the-street neighbor name susan spungen ’ cookbook author food stylist whether realiz ’ probabl admir behind-the-scen handiwork movi — see croissant scene ’ complic oh everyth ami adam meryl streep cook juli julia latter project got good appl tart tatin explain “ quick shot work hard get right look techniqu could make look exactli time essenti movi scene ”,Food
smitten kitchen abandon onlin spend time person better part last two month lead prematur rightli deserv obituari spend half fall town obsess dutch appl pie signific amount time tri understand seem divid wherein american home cook site larg refer dutch appl pie deep-dish appl pie sometim alway cake pan crumb top dutch dutch-sound speak languag make educ guess cook use cookie-lik dough ’ cross-cross top shini finish fortun around time rememb one son ’ good friend ’ mom dutch happi set right cours ye lattic shini dough sweet butteri tast american counterpart end result look like cake pleas rememb send sampl races… sort first watch lot video home cook make two recip precis agre basic throw hand air hope could work kitchen alway happen — figur thing earli go — time hope good omen year come cook wish list 2018 could fill five calendar much much easier look realiz dutch appl pie may everyon ’ even peopl ’ christma tradit look gloriou thing think deserv chanc ’ fragrant butteri rustic fanci proper way eat mani thing worth eat mit schlag whip cream realli inordin amount save dainti dollop differ parti also want warn one thing ’ think look deep site ’ archiv find evid devot american-styl pie know singl bite warm pie pillow bare sweeten cream wonder ’ ever want eat american appl pie,Food
smitten kitchen thing learn host first friendsgiv • realiz last week make big meal 16 peopl scari ’ cook much sheer volum logist requir manag mean kitchen built feed 16 trust ’ ’ kitchen make thing hard • thu time spend plot thing less stress ’ team casserol i.e prefer dish deep bubbl made well advanc reheat well ’ fairli forgiv long short warm time long get littl extra crunchi toast top yum littl still pack lot warmth insid even ’ bubbl hot warm dish turkey went slid one two roast turkey came need 30 minut rest carv side went back warm • everyth done advanc earli possibl ’ lot peopl often lead quit over-exhaust night get everyth prep wake rest ’ 80 ’ actual stress day mean ’ far like enjoy parti ’ finish prep night ’ morn ’ essenti ’ littl window vegging/non-cook time prep stuff cook stuff must done last-minut ’ also great time chang someth fresh • pie made earlier week either went fridg pecan freezer pumpkin need • final think buy trivet christmukkah have… 4 kind thanksgiv 4 hot dish come kitchen none want thank much,Food
smitten kitchen ’ say often enough know one favorit thing site way presenc whether activ lurk quietli provid encourag need everi time want tackl dish recip daunt like bagel lasagna bolognes bake alaska russian honey cake ’ sure dish struck terror heart — lace impend doom inevit failur — dish much let rewind littl lucki enough preview page luisa weiss ’ new cookbook classic german bake june around birthday mother gone cafe sabarski one great new york citi love lunch mother ’ parent germani although ’ leav good circumst huge soft spot bake good region book — fill sachertort glaze chocol tort kid left book open morn unsubtl hint mandelhörnchen almond horn amerikan origin black-and-whit cooki butterkuchen linzertort bretzlen soft pretzel mile christma favorit — envelop us intens long run kitchen buri flour butter almond yeast come one two year clear would imposs choos bake first saw three-pag spread apfelstrudel fright took hold ’ watch video peopl make appl strudel — massiv tabl dough stretch film-thin famili hand nobodi allow stop newspap could read conclud sane person would best left pro read recip — damn luisa eloqu reassur write — appl flour oil butter breadcrumb raisin absolut zero voodoo and…,Food
